search_term,uniprot_accession,gene_name,description,ec_number,synonyms,location,keywords,go_terms,family,zinc_link,cansar_link,nearest_drug_target,matching_drug_target_50,matching_drug_target_35,number_of_3d_structure,number_of_3d_structure_with_small_molecule_ligand,number_of_3d_structure_with_druggability,number_of_3d_structure_druggable,percentage_of_3d_structure_druggable,number_of_3d_structure_tractable,percentage_of_3d_structure_tractable,ligand_druggability_score,ligand_druggability_percentile_rank,matching_protein_variants,screened_compounds,screened_compounds_active,screened_compounds_active_ro5,screened_fragments,screened_fragments_active,screened_fragments_active_ro5,most_prevalent_mutation,most_prevalent_cnv,highest_expressing_celllines
,O14686,KMT2D,"Histone-lysine N-methyltransferase 2D",2.1.1.354,"KMT2D_HUMAN, KMT2D, ALR, MLL2, MLL4",Nucleus,"O14686 KMT2D_HUMAN Histone-lysine N-methyltransferase 2D O14686,O14687 ALL1-related protein, Myeloid/lymphoid or mixed-lineage leukemia protein 2 ALR, MLL2, MLL4","histone methyltransferase complex, mll3/4 complex, nucleoplasm, nucleus",,http://zinc.docking.org/results/combination?filter.purchasability=purchasable&annotation.name=KMT2D_HUMAN,https://cansarblack.icr.ac.uk/target/O14686/synopsis,36.97|Q15910|EZH2|TAZEMETOSTAT|Whole:::Protein,,36.97|Q15910|EZH2|TAZEMETOSTAT|Whole:::Protein,,,,,0,,0,1.35,93,,,,,,,,,,
,Q8WXI7,MUC16,Mucin-16,,"MUC16_HUMAN, MUC16, CA125","Cell membrane, Secreted, Extracellular space","Q8WXI7 MUC16_HUMAN Mucin-16 Q8WXI7,B5ME49,Q6ZQW5,Q96RK2 Ovarian cancer-related tumor marker CA125, Ovarian carcinoma antigen CA125 CA125","extracellular exosome, extrinsic component of membrane, golgi lumen, integral component of membrane, plasma membrane, vesicle",,http://zinc.docking.org/results/combination?filter.purchasability=purchasable&annotation.name=MUC16_HUMAN,https://cansarblack.icr.ac.uk/target/Q8WXI7/synopsis,,,,,,,,0,,0,0.5,85,,,,,,,,,,
,Q99102,MUC4,Mucin-4,,"MUC4_HUMAN, MUC4","Membrane, Secreted, Cell membrane, Secreted, Cell membrane, Secreted, Secreted, Cell membrane","Q99102 MUC4_HUMAN Mucin-4 Q99102,O95938,Q9GZM2,Q9GZV6,Q9H481,Q9H482,Q9H483,Q9H484,Q9H485,Q9H486,Q9H487,Q9H4D6,Q9H4D8,Q9NPJ0,Q9NY09,Q9NY75,Q9NY76,Q9NY77,Q9NY78,Q9NY79,Q9NY80,Q9NY81 Ascites sialoglycoprotein, Pancreatic adenocarcinoma mucin, Testis mucin, Tracheobronchial mucin ","extracellular exosome, extracellular matrix, extracellular space, golgi lumen, integral component of plasma membrane, membrane, plasma membrane, vesicle",,http://zinc.docking.org/results/combination?filter.purchasability=purchasable&annotation.name=MUC4_HUMAN,https://cansarblack.icr.ac.uk/target/Q99102/synopsis,,,,,,,,0,,0,-3,59,,,,,,,,,,
,Q16236,NFE2L2,"Nuclear factor erythroid 2-related factor 2",,"NF2L2_HUMAN, NFE2L2, NRF2","Cytoplasm, Cytosol, Nucleus","Q16236 NF2L2_HUMAN Nuclear factor erythroid 2-related factor 2 Q16236,B2RBU2,B4E338,E9PGJ7,Q53RW6,Q59HH2,Q96F71 HEBP1, Nuclear factor, erythroid derived 2, like 2 NRF2","centrosome, chromatin, cytoplasm, cytosol, golgi apparatus, nucleoplasm, nucleus, plasma membrane, protein-dna complex",,http://zinc.docking.org/results/combination?filter.purchasability=purchasable&annotation.name=NF2L2_HUMAN,https://cansarblack.icr.ac.uk/target/Q16236/synopsis,,,,,,,,0,,0,-0.4,75,,,,,,,,,,
,P46531,NOTCH1,"Neurogenic locus notch homolog protein 1",,"NOTC1_HUMAN, NOTCH1, TAN1","Cell membrane, Nucleus","P46531 NOTC1_HUMAN Neurogenic locus notch homolog protein 1 P46531,Q59ED8,Q5SXM3 Translocation-associated notch protein TAN-1 TAN1","acrosomal vesicle, adherens junction, apical plasma membrane, cell surface, cytosol, endoplasmic reticulum membrane, extracellular region, golgi membrane, integral component of membrane, maml1-rbp-jkappa- icn1 complex, nucleoplasm, nucleus, plasma membrane, receptor complex",,http://zinc.docking.org/results/combination?filter.purchasability=purchasable&annotation.name=NOTC1_HUMAN,https://cansarblack.icr.ac.uk/target/P46531/synopsis,,,,,,,,0,,0,1.4,94,,,,,,,,,,
,P42336,PIK3CA,"Phosphatidylinositol 4,5-bisphosphate 3-kinase catalytic subunit alpha isoform",2.7.1.137,"PK3CA_HUMAN, PIK3CA",,"P42336 PK3CA_HUMAN Phosphatidylinositol 4,5-bisphosphate 3-kinase catalytic subunit alpha isoform P42336,Q14CW1,Q99762 Phosphatidylinositol 4,5-bisphosphate 3-kinase 110 kDa catalytic subunit alpha, Phosphoinositide 3-kinase alpha, Phosphoinositide-3-kinase catalytic alpha polypeptide, Serine/threonine protein kinase PIK3CA ","cytoplasm, cytosol, intercalated disc, lamellipodium, membrane, perinuclear region of cytoplasm, phosphatidylinositol 3-kinase complex, phosphatidylinositol 3-kinase complex, phosphatidylinositol 3-kinase complex, plasma membrane",,http://zinc.docking.org/results/combination?filter.purchasability=purchasable&annotation.name=PK3CA_HUMAN,https://cansarblack.icr.ac.uk/target/P42336/synopsis,"100.00|P42336|PIK3CA|ALPELISIB,COPANLISIB,COPANLISIB HYDROCHLORIDE|Whole:::Protein","100.00|P42336|PIK3CA|ALPELISIB,COPANLISIB,COPANLISIB HYDROCHLORIDE|Whole:::Protein","100.00|P42336|PIK3CA|ALPELISIB,COPANLISIB,COPANLISIB HYDROCHLORIDE|Whole:::Protein||40.15|O00329|PIK3CD|COPANLISIB,COPANLISIB HYDROCHLORIDE,DUVELISIB,40L|Whole:::Protein||35.91|P48736|PIK3CG|DUVELISIB|Whole:::Protein",,,,,0,,0,1.95,97,,,,,,,,,,
,P04637,TP53,"Cellular tumor antigen p53",,"P53_HUMAN, TP53, P53","Cytoplasm, Nucleus, Nucleus, PML body, Endoplasmic reticulum, Mitochondrion matrix, Cytoplasm, Cytoskeleton, Microtubule organizing center, Centrosome, Nucleus, Cytoplasm, Nucleus, Cytoplasm, Nucleus, Cytoplasm, Nucleus, Cytoplasm, Nucleus, Cytoplasm, Nucleus, Cytoplasm, Cytoplasm","P04637 P53_HUMAN Cellular tumor antigen p53 P04637,Q15086,Q15087,Q15088,Q16535,Q16807,Q16808,Q16809,Q16810,Q16811,Q16848,Q2XN98,Q3LRW1,Q3LRW2,Q3LRW3,Q3LRW4,Q3LRW5,Q86UG1,Q8J016,Q99659,Q9BTM4,Q9HAQ8,Q9NP68,Q9NPJ2,Q9NZD0,Q9UBI2,Q9UQ61 Antigen NY-CO-13, Phosphoprotein p53, Tumor suppressor p53 P53","centrosome, chromatin, cytoplasm, cytosol, endoplasmic reticulum, mitochondrial matrix, mitochondrion, nuclear matrix, nucleolus, nucleoplasm, nucleus, pml body, protein-containing complex, replication fork, site of double-strand break, transcription regulator complex",,http://zinc.docking.org/results/combination?filter.purchasability=purchasable&annotation.name=P53_HUMAN,https://cansarblack.icr.ac.uk/target/P04637/synopsis,,,,,,,,0,,0,-0.1,78,,,,,,,,,,
